{
  "$schema": "https://local.stockmodel/standard_template_style_policy.schema.json",
  "version": "1.3.0",
  "style_plan_contract_version": "1.0.0",
  "description": "Ticker-neutral exact-cell signal-fill policies for activated standard-template modules. The contract owns thresholds, polarity, comparison basis and palette; formula economics remain owned by the generic formula contracts.",
  "palette_tokens": {
    "strong_negative": {
      "fill": {
        "fill_type": "solid",
        "fg_color": "A63A00"
      }
    },
    "negative": {
      "fill": {
        "fill_type": "solid",
        "fg_color": "D55E00"
      }
    },
    "neutral": {
      "fill": {
        "fill_type": "solid",
        "fg_color": "DDDDDD"
      }
    },
    "positive": {
      "fill": {
        "fill_type": "solid",
        "fg_color": "9BD3F5"
      }
    },
    "strong_positive": {
      "fill": {
        "fill_type": "solid",
        "fg_color": "2F80ED"
      }
    },
    "hidden_value_triggered": {
      "fill": {
        "fill_type": "solid",
        "fg_color": "C6EFCE"
      },
      "font_color": "006100"
    },
    "hidden_value_near_miss": {
      "fill": {
        "fill_type": "solid",
        "fg_color": "FFEB9C"
      },
      "font_color": "9C6500"
    },
    "hidden_value_invalid": {
      "fill": {
        "fill_type": "solid",
        "fg_color": "FFC7CE"
      },
      "font_color": "9C0006"
    },
    "hidden_value_unavailable": {
      "fill": {
        "fill_type": "solid",
        "fg_color": "E7E6E6"
      },
      "font_color": "666666"
    }
  },
  "threshold_sets": [
    {
      "threshold_set_id": "legacy_five_band_change",
      "bands": [
        {
          "band_id": "strong_negative",
          "overlay_token": "strong_negative",
          "maximum": -0.15,
          "maximum_inclusive": true
        },
        {
          "band_id": "negative",
          "overlay_token": "negative",
          "minimum": -0.15,
          "minimum_inclusive": false,
          "maximum": -0.05,
          "maximum_inclusive": true
        },
        {
          "band_id": "neutral",
          "overlay_token": "neutral",
          "minimum": -0.05,
          "minimum_inclusive": false,
          "maximum": 0.05,
          "maximum_inclusive": false
        },
        {
          "band_id": "positive",
          "overlay_token": "positive",
          "minimum": 0.05,
          "minimum_inclusive": true,
          "maximum": 0.15,
          "maximum_inclusive": false
        },
        {
          "band_id": "strong_positive",
          "overlay_token": "strong_positive",
          "minimum": 0.15,
          "minimum_inclusive": true
        }
      ]
    }
  ],
  "policies": [
    {
      "policy_id": "valuation_core_raw_yoy_higher",
      "owner_module_id": "core_financial_history",
      "owned_style_ids": [
        "valuation_income_history_style",
        "valuation_operating_history_style",
        "valuation_share_history_style"
      ],
      "metric_family": "core_financials",
      "period_type": "quarter",
      "period_axis_id": "valuation_quarterly_periods",
      "comparison_basis": "prior_year_quarter",
      "comparison_lag": 4,
      "polarity": "higher_is_better",
      "threshold_set_id": "legacy_five_band_change",
      "accepted_units": [
        "$m",
        "$/share"
      ],
      "applies_to": [
        "raw"
      ],
      "missing_value_behavior": "no_style",
      "comparator_missing_behavior": "no_style",
      "status_exclusions": [
        "missing_source",
        "manual_review_required",
        "not_populated",
        "invalid",
        "conflict"
      ],
      "legacy_reference": "excel_writer_coloring._quarterly_row_color_policy: default YoY, higher-better result metrics",
      "target_selectors": [
        {
          "selector_type": "binding",
          "target_id": "valuation_revenue_series",
          "metric_id": "revenue"
        },
        {
          "selector_type": "binding",
          "target_id": "valuation_ebitda_series",
          "metric_id": "base_ebitda"
        },
        {
          "selector_type": "binding",
          "target_id": "valuation_operating_income_series",
          "metric_id": "operating_income"
        },
        {
          "selector_type": "binding",
          "target_id": "valuation_net_income_series",
          "metric_id": "net_income"
        },
        {
          "selector_type": "binding",
          "target_id": "valuation_eps_series",
          "metric_id": "eps"
        }
      ]
    },
    {
      "policy_id": "valuation_core_raw_yoy_lower",
      "owner_module_id": "core_financial_history",
      "owned_style_ids": [
        "valuation_share_history_style"
      ],
      "metric_family": "share_count",
      "period_type": "quarter",
      "period_axis_id": "valuation_quarterly_periods",
      "comparison_basis": "prior_year_quarter",
      "comparison_lag": 4,
      "polarity": "lower_is_better",
      "threshold_set_id": "legacy_five_band_change",
      "accepted_units": [
        "m shares"
      ],
      "applies_to": [
        "raw"
      ],
      "missing_value_behavior": "no_style",
      "comparator_missing_behavior": "no_style",
      "status_exclusions": [
        "missing_source",
        "manual_review_required",
        "not_populated",
        "invalid",
        "conflict"
      ],
      "legacy_reference": "excel_writer_coloring._quarterly_color_directionality_for_label: share counts are lower-better",
      "target_selectors": [
        {
          "selector_type": "binding",
          "target_id": "valuation_diluted_shares_series",
          "metric_id": "diluted_shares"
        },
        {
          "selector_type": "binding",
          "target_id": "valuation_shares_outstanding_series",
          "metric_id": "shares_outstanding"
        }
      ]
    },
    {
      "policy_id": "valuation_core_formula_yoy_direct",
      "owner_module_id": "core_financial_history",
      "owned_style_ids": [
        "valuation_income_history_style",
        "valuation_operating_history_style",
        "valuation_share_history_style"
      ],
      "metric_family": "growth_rate",
      "period_type": "quarter",
      "period_axis_id": "valuation_quarterly_periods",
      "comparison_basis": "direct_value",
      "comparison_lag": 0,
      "polarity": "higher_is_better",
      "threshold_set_id": "legacy_five_band_change",
      "accepted_units": [
        "%"
      ],
      "applies_to": [
        "formula"
      ],
      "missing_value_behavior": "no_style",
      "comparator_missing_behavior": "no_style",
      "status_exclusions": [
        "missing_source",
        "manual_review_required",
        "not_populated",
        "invalid",
        "conflict"
      ],
      "legacy_reference": "excel_writer_coloring._quarterly_color_basis_for_label: YoY percent rows are direct percentage-point signals",
      "target_selectors": [
        {
          "selector_type": "formula",
          "target_id": "revenue_yoy",
          "metric_id": "revenue_yoy"
        },
        {
          "selector_type": "formula",
          "target_id": "ebitda_yoy",
          "metric_id": "ebitda_yoy"
        },
        {
          "selector_type": "formula",
          "target_id": "net_income_yoy",
          "metric_id": "net_income_yoy"
        },
        {
          "selector_type": "formula",
          "target_id": "gaap_eps_yoy",
          "metric_id": "gaap_eps_yoy"
        }
      ]
    },
    {
      "policy_id": "valuation_core_formula_ttm",
      "owner_module_id": "core_financial_history",
      "owned_style_ids": [
        "valuation_income_history_style",
        "valuation_operating_history_style",
        "valuation_share_history_style"
      ],
      "metric_family": "trailing_financials",
      "period_type": "quarter",
      "period_axis_id": "valuation_quarterly_periods",
      "comparison_basis": "prior_ttm",
      "comparison_lag": 4,
      "polarity": "higher_is_better",
      "threshold_set_id": "legacy_five_band_change",
      "accepted_units": [
        "$m",
        "$/share"
      ],
      "applies_to": [
        "formula"
      ],
      "missing_value_behavior": "no_style",
      "comparator_missing_behavior": "no_style",
      "status_exclusions": [
        "missing_source",
        "manual_review_required",
        "not_populated",
        "invalid",
        "conflict"
      ],
      "legacy_reference": "excel_writer_coloring._quarterly_color_basis_for_label: TTM versus prior TTM",
      "target_selectors": [
        {
          "selector_type": "formula",
          "target_id": "revenue_ttm",
          "metric_id": "revenue_ttm"
        },
        {
          "selector_type": "formula",
          "target_id": "ebitda_ttm",
          "metric_id": "ebitda_ttm"
        },
        {
          "selector_type": "formula",
          "target_id": "operating_income_ttm",
          "metric_id": "operating_income_ttm"
        },
        {
          "selector_type": "formula",
          "target_id": "net_income_ttm",
          "metric_id": "net_income_ttm"
        },
        {
          "selector_type": "formula",
          "target_id": "gaap_eps_ttm",
          "metric_id": "gaap_eps_ttm"
        }
      ]
    },
    {
      "policy_id": "valuation_share_delta_direct_lower",
      "owner_module_id": "core_financial_history",
      "owned_style_ids": [
        "valuation_share_history_style"
      ],
      "metric_family": "share_count_delta",
      "period_type": "quarter",
      "period_axis_id": "valuation_quarterly_periods",
      "comparison_basis": "direct_value",
      "comparison_lag": 0,
      "polarity": "lower_is_better",
      "threshold_set_id": "legacy_five_band_change",
      "accepted_units": [
        "m shares"
      ],
      "applies_to": [
        "formula"
      ],
      "missing_value_behavior": "no_style",
      "comparator_missing_behavior": "no_style",
      "status_exclusions": [
        "missing_source",